{
  "schema_version": "1.1.0",
  "study": {
    "dataset": "MVTec AD 2 public",
    "evidence_timing": "post-result-corrective",
    "categories": [
      "can",
      "fabric",
      "fruit_jelly",
      "rice",
      "sheet_metal",
      "vial",
      "wallplugs",
      "walnuts"
    ],
    "detectors": [
      "patchcore",
      "padim",
      "efficient_ad"
    ],
    "seeds": [
      17,
      42,
      73
    ],
    "seed_aggregation": "mean; seeds are not independent images"
  },
  "matched_analysis": {
    "estimand_version": "loo-matched-v1",
    "estimand": "mean over validation deletions, fixed target normals, and seeds of I(target>t_-i)-I(source_i>t_-i)",
    "calibration_threshold": "n-1 leave-one-out threshold shared by source and target indicators",
    "target_normals_fixed": true,
    "confidence": 0.95,
    "bootstrap_replicates": 20000,
    "bootstrap_seed": 20260813,
    "uncertainty_scope": "approximate calibration-sample inference conditional on fixed target-normal benchmark",
    "family_multiplicity": "24 cells controlled within each family; no control across eight families",
    "gate": {
      "minimum_categories": 2,
      "minimum_detectors": 2,
      "all_families_must_pass": true,
      "passed": true
    },
    "families": [
      {
        "family_id": "empirical_p95:image-score",
        "threshold": {
          "rule": "empirical_p95",
          "definition": "empirical 0.95 quantile",
          "parameters": {
            "quantile": 0.95,
            "quantile_method": "higher"
          },
          "decision_operator": ">"
        },
        "endpoint": "image-score",
        "family_size": 24,
        "critical_value": 4.53503435888708,
        "positive_cell_count": 10,
        "positive_categories": [
          "can",
          "fabric",
          "rice",
          "sheet_metal",
          "vial",
          "wallplugs",
          "walnuts"
        ],
        "positive_detectors": [
          "efficient_ad",
          "padim",
          "patchcore"
        ],
        "gate_passed": true,
        "cells": [
          {
            "category": "can",
            "detector": "patchcore",
            "calibration_count": 46,
            "target_normal_count": 72,
            "source_normal_fpr": 0.06521739130434782,
            "target_normal_fpr": 0.4635668276972625,
            "observed_matched_gap": 0.3983494363929146,
            "bootstrap_standard_error": 0.052827773813212776,
            "lower_bound": 0.15877366704647952,
            "unsupported": false,
            "supports_positive_gap": true
          },
          {
            "category": "can",
            "detector": "padim",
            "calibration_count": 46,
            "target_normal_count": 72,
            "source_normal_fpr": 0.06521739130434782,
            "target_normal_fpr": 0.6391908212560387,
            "observed_matched_gap": 0.5739734299516909,
            "bootstrap_standard_error": 0.04613828130354144,
            "lower_bound": 0.3647347389801331,
            "unsupported": false,
            "supports_positive_gap": true
          },
          {
            "category": "can",
            "detector": "efficient_ad",
            "calibration_count": 46,
            "target_normal_count": 72,
            "source_normal_fpr": 0.06521739130434781,
            "target_normal_fpr": 0.8567834138486313,
            "observed_matched_gap": 0.7915660225442834,
            "bootstrap_standard_error": 0.02170145002631097,
            "lower_bound": 0.6931492010372923,
            "unsupported": false,
            "supports_positive_gap": true
          },
          {
            "category": "fabric",
            "detector": "patchcore",
            "calibration_count": 43,
            "target_normal_count": 66,
            "source_normal_fpr": 0.06976744186046512,
            "target_normal_fpr": 0.1614987080103359,
            "observed_matched_gap": 0.0917312661498708,
            "bootstrap_standard_error": 0.08957732685942518,
            "lower_bound": -0.3145049889348808,
            "unsupported": true,
            "supports_positive_gap": false
          },
          {
            "category": "fabric",
            "detector": "padim",
            "calibration_count": 43,
            "target_normal_count": 66,
            "source_normal_fpr": 0.0697674418604651,
            "target_normal_fpr": 0.11827578106647872,
            "observed_matched_gap": 0.04850833920601362,
            "bootstrap_standard_error": 0.05012879757119565,
            "lower_bound": -0.1788274801490538,
            "unsupported": true,
            "supports_positive_gap": false
          },
          {
            "category": "fabric",
            "detector": "efficient_ad",
            "calibration_count": 43,
            "target_normal_count": 66,
            "source_normal_fpr": 0.06976744186046512,
            "target_normal_fpr": 0.7528776133427296,
            "observed_matched_gap": 0.6831101714822645,
            "bootstrap_standard_error": 0.020155939399106593,
            "lower_bound": 0.5917022937716703,
            "unsupported": false,
            "supports_positive_gap": true
          },
          {
            "category": "fruit_jelly",
            "detector": "patchcore",
            "calibration_count": 37,
            "target_normal_count": 20,
            "source_normal_fpr": 0.05405405405405405,
            "target_normal_fpr": 0.15,
            "observed_matched_gap": 0.09594594594594594,
            "bootstrap_standard_error": 0.07161207393087525,
            "lower_bound": -0.22881726984173503,
            "unsupported": true,
            "supports_positive_gap": false
          },
          {
            "category": "fruit_jelly",
            "detector": "padim",
            "calibration_count": 37,
            "target_normal_count": 20,
            "source_normal_fpr": 0.05405405405405406,
            "target_normal_fpr": 0.0,
            "observed_matched_gap": -0.05405405405405406,
            "bootstrap_standard_error": 0.054327793876633786,
            "lower_bound": -0.30043246592712336,
            "unsupported": true,
            "supports_positive_gap": false
          },
          {
            "category": "fruit_jelly",
            "detector": "efficient_ad",
            "calibration_count": 37,
            "target_normal_count": 20,
            "source_normal_fpr": 0.05405405405405406,
            "target_normal_fpr": 0.03333333333333333,
            "observed_matched_gap": -0.020720720720720717,
            "bootstrap_standard_error": 0.06992862154597042,
            "lower_bound": -0.3378494221013079,
            "unsupported": true,
            "supports_positive_gap": false
          },
          {
            "category": "rice",
            "detector": "patchcore",
            "calibration_count": 35,
            "target_normal_count": 42,
            "source_normal_fpr": 0.05714285714285714,
            "target_normal_fpr": 0.12040816326530612,
            "observed_matched_gap": 0.06326530612244899,
            "bootstrap_standard_error": 0.05493308541594257,
            "lower_bound": -0.1858581236785293,
            "unsupported": true,
            "supports_positive_gap": false
          },
          {
            "category": "rice",
            "detector": "padim",
            "calibration_count": 35,
            "target_normal_count": 42,
            "source_normal_fpr": 0.057142857142857134,
            "target_normal_fpr": 0.017233560090702947,
            "observed_matched_gap": -0.039909297052154194,
            "bootstrap_standard_error": 0.022450559554724473,
            "lower_bound": -0.1417233560090703,
            "unsupported": true,
            "supports_positive_gap": false
          },
          {
            "category": "rice",
            "detector": "efficient_ad",
            "calibration_count": 35,
            "target_normal_count": 42,
            "source_normal_fpr": 0.05714285714285714,
            "target_normal_fpr": 0.6913832199546485,
            "observed_matched_gap": 0.6342403628117914,
            "bootstrap_standard_error": 0.02953209764750982,
            "lower_bound": 0.5003112852903261,
            "unsupported": false,
            "supports_positive_gap": true
          },
          {
            "category": "sheet_metal",
            "detector": "patchcore",
            "calibration_count": 19,
            "target_normal_count": 24,
            "source_normal_fpr": 0.05263157894736842,
            "target_normal_fpr": 0.0043859649122807015,
            "observed_matched_gap": -0.04824561403508772,
            "bootstrap_standard_error": 0.11853029223574293,
            "lower_bound": -0.5857845618931085,
            "unsupported": true,
            "supports_positive_gap": false
          },
          {
            "category": "sheet_metal",
            "detector": "padim",
            "calibration_count": 19,
            "target_normal_count": 24,
            "source_normal_fpr": 0.05263157894736842,
            "target_normal_fpr": 0.41959064327485385,
            "observed_matched_gap": 0.3669590643274854,
            "bootstrap_standard_error": 0.03660096127559678,
            "lower_bound": 0.2009724473743585,
            "unsupported": false,
            "supports_positive_gap": true
          },
          {
            "category": "sheet_metal",
            "detector": "efficient_ad",
            "calibration_count": 19,
            "target_normal_count": 24,
            "source_normal_fpr": 0.05263157894736842,
            "target_normal_fpr": 0.7638888888888888,
            "observed_matched_gap": 0.7112573099415205,